{"$schema":"https://json-schema.org/draft/2020-12/schema","$id":"https://bigbirdreturns.github.io/undercast/schema/clifford-number-hr-burden-allocation-lane.schema.json","title":"Clifford Number HR burden-allocation lane","type":"object","additionalProperties":false,"required":["schema_version","wave_id","lane_id","case_id","name","source_ids","observations","findings","terminal_receipt","authority"],"properties":{"schema_version":{"const":1},"wave_id":{"const":"CN-HRBA-W12"},"lane_id":{"pattern":"^HRBA-0[1-6]$"},"case_id":{"type":"string"},"name":{"type":"string"},"source_ids":{"type":"array","minItems":2,"uniqueItems":true},"observations":{"type":"array","minItems":6,"maxItems":6},"findings":{"type":"array","minItems":4,"maxItems":4},"terminal_receipt":{"type":"object"},"authority":{"type":"object"}}}
