{"schema_version":1,"wave_id":"CN-HRBA-W12","lane_id":"HRBA-02","case_id":"AMIN-ABDULLAH-2016","name":"Amin Abdullah","source_ids":["amin-verita-report","amin-itv-report","amin-imperial-learning","nhs-being-fair","nhs-just-learning-case","last-resort-study"],"observations":[{"id":"HRBA-02-O01","statement":"The retained public record makes the burden-allocation and cost-internalization chain in the Amin Abdullah sentinel addressable within its stated scope.","source_ids":["amin-verita-report","amin-itv-report"],"limits":["Observation is bounded to the inherited public source record."]},{"id":"HRBA-02-O02","statement":"Employment, health, reputational, procedural, family, and public-system effects remain separately classified rather than collapsed into one causal claim.","source_ids":["amin-verita-report","amin-itv-report"],"limits":["Observation is bounded to the inherited public source record."]},{"id":"HRBA-02-O03","statement":"Training, review, policy, or programme change is retained as an institutional response object rather than promoted into personal consequence, worker repair, or prevention.","source_ids":["amin-verita-report","amin-itv-report"],"limits":["Observation is bounded to the inherited public source record."]},{"id":"HRBA-02-O04","statement":"The public record does not provide a complete transaction-level receipt for all authors, advisers, corrective authorities, consequences, repairs, and later validation.","source_ids":["amin-verita-report","amin-itv-report"],"limits":["Observation is bounded to the inherited public source record."]},{"id":"HRBA-02-O05","statement":"Absence of a public consequence record remains missing evidence and cannot be converted into proof that no consequence occurred.","source_ids":["amin-verita-report","amin-itv-report"],"limits":["Observation is bounded to the inherited public source record."]},{"id":"HRBA-02-O06","statement":"Closure remains blocked where implementation, repair, recurrence escalation, or affected-population learning is incomplete.","source_ids":["amin-verita-report","amin-itv-report"],"limits":["Observation is bounded to the inherited public source record."]}],"findings":[{"id":"HRBA-02-F01","claim":"The public record is materially richer on visible harm and institutional response than on the complete burden-allocation and cost-internalization chain.","status":"independently_supported_scoped","source_ids":["amin-verita-report","amin-itv-report"],"limits":["Finding does not establish legal liability, individual culpability, or undisclosed consequences."]},{"id":"HRBA-02-F02","claim":"Institutional response activity cannot by itself establish accountable consequence, repair, or durable prevention.","status":"bounded_synthesis","source_ids":["amin-verita-report","amin-itv-report"],"limits":["Finding does not establish legal liability, individual culpability, or undisclosed consequences."]},{"id":"HRBA-02-F03","claim":"Missing public consequence evidence cannot establish either impunity or accountability.","status":"boundary","source_ids":["amin-verita-report","amin-itv-report"],"limits":["Finding does not establish legal liability, individual culpability, or undisclosed consequences."]},{"id":"HRBA-02-F04","claim":"The complete transaction remains open on the retained public record.","status":"remains_blocked","source_ids":["amin-verita-report","amin-itv-report"],"limits":["Finding does not establish legal liability, individual culpability, or undisclosed consequences."]}],"terminal_receipt":{"state":"formal_failure_and_reform_cost_visible_personal_consequence_compensation_and_complete_repair_open","closed_questions":[],"open_questions":["Who authored each consequential decision and advice step?","Who held independent corrective authority?","What personal or role consequence decision was made?","What worker or record repair was completed?","What compensation or restoration was completed?","What operative system change was independently verified?","Did recurrence increase the burden carried by accountable owners?","Which exited, silent, deterred, restored, or appealed people remain outside the denominator?"]},"authority":{"ai_caused_chloe_moffat_death_claims_allowed":false,"canonical_product_effects_allowed":false,"closure_by_silence_allowed":false,"control_adoption_allowed":false,"employer_liability_findings_allowed":false,"employer_specific_causation_findings_allowed":false,"external_contact_required":false,"final_coroner_conclusion_claims_allowed":false,"graph_effects_allowed":false,"individual_culpability_findings_allowed":false,"legal_conclusions_allowed":false,"named_company_intent_beyond_public_record_allowed":false,"parent_wave_mutation_allowed":false,"private_source_publication_allowed":false,"publication_effects_allowed":false,"recurrence_to_universal_prevalence_promotion_allowed":false,"self_report_to_independent_verification_promotion_allowed":false,"victim_character_inferences_allowed":false,"burden_visibility_to_causation_promotion_allowed":false,"decision_owner_consequence_inference_allowed":false,"institution_cost_to_worker_repair_promotion_allowed":false,"lack_of_public_consequence_to_no_consequence_inference_allowed":false,"training_to_accountability_promotion_allowed":false,"universal_burden_allocation_findings_allowed":false}}
